{
  "grade": 3,
  "totalKanji": 200,
  "units": [
    {
      "book": "上",
      "name": "白い花びら",
      "kanji": [
        "開",
        "返",
        "事",
        "動",
        "物",
        "乗",
        "登",
        "主",
        "橋",
        "岸"
      ]
    },
    {
      "book": "上",
      "name": "発見ノート",
      "kanji": [
        "発",
        "予",
        "想",
        "調",
        "葉",
        "表",
        "由",
        "温"
      ]
    },
    {
      "book": "上",
      "name": "言葉の広場① 国語辞典のつかい方",
      "kanji": [
        "漢",
        "意",
        "味",
        "号",
        "重",
        "問"
      ]
    },
    {
      "book": "上",
      "name": "わたしのたからもの",
      "kanji": [
        "練",
        "習"
      ]
    },
    {
      "book": "上",
      "name": "漢字の広場① 漢字学習ノート",
      "kanji": [
        "感",
        "運",
        "転",
        "集"
      ]
    },
    {
      "book": "上",
      "name": "うめぼしのはたらき",
      "kanji": [
        "実",
        "消"
      ]
    },
    {
      "book": "上",
      "name": "めだか",
      "kanji": [
        "化",
        "面",
        "泳",
        "身",
        "守",
        "第",
        "次",
        "死",
        "度",
        "流",
        "研",
        "究",
        "秒",
        "昭",
        "和"
      ]
    },
    {
      "book": "上",
      "name": "読書の広場① 本をさがそう",
      "kanji": [
        "館"
      ]
    },
    {
      "book": "上",
      "name": "クラスの『生き物ブック』",
      "kanji": [
        "章",
        "全",
        "題"
      ]
    },
    {
      "book": "上",
      "name": "漢字の広場② 漢字の音と訓",
      "kanji": [
        "皮",
        "相",
        "庭",
        "命",
        "炭",
        "品",
        "平",
        "皿",
        "等",
        "代"
      ]
    },
    {
      "book": "上",
      "name": "紙ひこうき、きみへ",
      "kanji": [
        "着",
        "客",
        "待",
        "持",
        "具",
        "取",
        "旅",
        "様",
        "悲",
        "部",
        "屋"
      ]
    },
    {
      "book": "上",
      "name": "『りす公園』はどこにある？",
      "kanji": [
        "遊",
        "駅",
        "曲"
      ]
    },
    {
      "book": "上",
      "name": "取材したことを ほうこく文に",
      "kanji": [
        "仕",
        "写",
        "真",
        "礼",
        "安",
        "商",
        "員",
        "区"
      ]
    },
    {
      "book": "上",
      "name": "自分の気持ちを手紙に",
      "kanji": [
        "申",
        "送",
        "所",
        "丁",
        "住"
      ]
    },
    {
      "book": "上",
      "name": "漢字の広場③ 送りがな",
      "kanji": [
        "打",
        "飲",
        "負",
        "暑",
        "暗",
        "洋",
        "服",
        "育",
        "苦",
        "薬"
      ]
    },
    {
      "book": "上",
      "name": "わすれられないおくりもの",
      "kanji": [
        "助",
        "向",
        "幸",
        "終",
        "速",
        "者",
        "寒",
        "央"
      ]
    },
    {
      "book": "上",
      "name": "言葉の文化① 俳句に親しむ",
      "kanji": [
        "陽",
        "氷",
        "有"
      ]
    },
    {
      "book": "上",
      "name": "言葉の文化② きせつの言葉を集めよう",
      "kanji": [
        "植",
        "緑",
        "祭",
        "湯",
        "豆",
        "式"
      ]
    },
    {
      "book": "下",
      "name": "世界の人につたわるように",
      "kanji": [
        "世",
        "界",
        "注"
      ]
    },
    {
      "book": "下",
      "name": "くらしと絵文字",
      "kanji": [
        "進",
        "指",
        "役",
        "港",
        "箱",
        "深",
        "病",
        "院",
        "都"
      ]
    },
    {
      "book": "下",
      "name": "わたしたちの絵文字",
      "kanji": [
        "反",
        "対",
        "整",
        "受"
      ]
    },
    {
      "book": "下",
      "name": "言葉の広場④ 気持ちをつたえる 話し方・聞き方",
      "kanji": [
        "級",
        "横"
      ]
    },
    {
      "book": "下",
      "name": "漢字の広場④ へんとつくり",
      "kanji": [
        "童",
        "談",
        "柱",
        "業",
        "倍",
        "投",
        "球",
        "宿",
        "勉",
        "放"
      ]
    },
    {
      "book": "下",
      "name": "モチモチの木",
      "kanji": [
        "両",
        "追",
        "落",
        "鼻",
        "起",
        "神",
        "歯",
        "医",
        "坂",
        "血"
      ]
    },
    {
      "book": "下",
      "name": "読書の広場③ 『おすすめ図書カード』を作ろう",
      "kanji": [
        "他",
        "銀",
        "油",
        "係"
      ]
    },
    {
      "book": "下",
      "name": "言葉の広場⑤ こそあど言葉",
      "kanji": [
        "農"
      ]
    },
    {
      "book": "下",
      "name": "はっとしたことを詩に",
      "kanji": [
        "湖",
        "美",
        "詩"
      ]
    },
    {
      "book": "下",
      "name": "言葉の文化③ ことわざ・慣用句",
      "kanji": [
        "短",
        "昔",
        "筆",
        "急",
        "根"
      ]
    },
    {
      "book": "下",
      "name": "ちいきの行事",
      "kanji": [
        "決",
        "使",
        "委",
        "始"
      ]
    },
    {
      "book": "下",
      "name": "言葉の広場⑥ 文の組み立て",
      "kanji": [
        "帳",
        "列",
        "局"
      ]
    },
    {
      "book": "下",
      "name": "漢字の広場⑤ 漢字の組み立て",
      "kanji": [
        "笛",
        "宮",
        "定",
        "庫"
      ]
    },
    {
      "book": "下",
      "name": "川をつなぐちえ",
      "kanji": [
        "島",
        "路",
        "荷",
        "県",
        "板",
        "階",
        "州",
        "鉄",
        "期"
      ]
    },
    {
      "book": "下",
      "name": "言葉の文化④ 十二支と月のよび名",
      "kanji": [
        "羊"
      ]
    },
    {
      "book": "下",
      "name": "強く心にのこっていることを",
      "kanji": [
        "族",
        "配"
      ]
    },
    {
      "book": "下",
      "name": "漢字の広場⑥ 二つの漢字の組み合わせ",
      "kanji": [
        "畑",
        "軽",
        "勝",
        "酒"
      ]
    },
    {
      "book": "下",
      "name": "おにたのぼうし",
      "kanji": [
        "君",
        "福",
        "去",
        "拾",
        "悪",
        "息",
        "波"
      ]
    }
  ],
  "kanjiDetails": {
    "開": {
      "book": "上",
      "page": 16,
      "unit": "白い花びら",
      "readings": {
        "primary": "ひら-く",
        "on": [
          "カイ"
        ],
        "kun": [
          "ひら-く",
          "ひら-ける",
          "あ-く",
          "あ-ける"
        ],
        "extra": []
      },
      "examples": [
        "開会式",
        "戸が開く",
        "開けた土地",
        "ドアが開く",
        "まどを開ける"
      ]
    },
    "返": {
      "book": "上",
      "page": 16,
      "unit": "白い花びら",
      "readings": {
        "primary": "かえ-る",
        "on": [
          "ヘン"
        ],
        "kun": [
          "かえ-す",
          "かえ-る"
        ],
        "extra": []
      },
      "examples": [
        "返答",
        "本を返す",
        "はね返る"
      ]
    },
    "事": {
      "book": "上",
      "page": 17,
      "unit": "白い花びら",
      "readings": {
        "primary": "ジ",
        "on": [
          "ジ"
        ],
        "kun": [
          "こと"
        ],
        "extra": [
          "ズ"
        ]
      },
      "examples": [
        "大事",
        "事がら"
      ]
    },
    "動": {
      "book": "上",
      "page": 17,
      "unit": "白い花びら",
      "readings": {
        "primary": "ドウ",
        "on": [
          "ドウ"
        ],
        "kun": [
          "うご-く",
          "うご-かす"
        ],
        "extra": []
      },
      "examples": [
        "自動車",
        "車が動く",
        "車を動かす"
      ]
    },
    "物": {
      "book": "上",
      "page": 17,
      "unit": "白い花びら",
      "readings": {
        "primary": "ブツ",
        "on": [
          "ブツ",
          "モツ"
        ],
        "kun": [
          "もの"
        ],
        "extra": []
      },
      "examples": [
        "人物",
        "作物",
        "物を買う"
      ]
    },
    "乗": {
      "book": "上",
      "page": 17,
      "unit": "白い花びら",
      "readings": {
        "primary": "の-る",
        "on": [
          "ジョウ"
        ],
        "kun": [
          "の-る",
          "の-せる"
        ],
        "extra": []
      },
      "examples": [
        "乗用車",
        "車に乗る",
        "人を乗せる"
      ]
    },
    "登": {
      "book": "上",
      "page": 18,
      "unit": "白い花びら",
      "readings": {
        "primary": "のぼ-る",
        "on": [
          "トウ",
          "ト"
        ],
        "kun": [
          "のぼ-る"
        ],
        "extra": []
      },
      "examples": [
        "登校する",
        "登山",
        "山に登る"
      ]
    },
    "主": {
      "book": "上",
      "page": 18,
      "unit": "白い花びら",
      "readings": {
        "primary": "シュ",
        "on": [
          "シュ"
        ],
        "kun": [
          "ぬし",
          "おも"
        ],
        "extra": [
          "ス"
        ]
      },
      "examples": [
        "主語",
        "地主",
        "主な物"
      ]
    },
    "橋": {
      "book": "上",
      "page": 30,
      "unit": "白い花びら",
      "readings": {
        "primary": "はし",
        "on": [
          "キョウ"
        ],
        "kun": [
          "はし"
        ],
        "extra": []
      },
      "examples": [
        "歩道橋",
        "橋をわたる"
      ]
    },
    "岸": {
      "book": "上",
      "page": 30,
      "unit": "白い花びら",
      "readings": {
        "primary": "きし",
        "on": [
          "ガン"
        ],
        "kun": [
          "きし"
        ],
        "extra": []
      },
      "examples": [
        "海岸",
        "川の岸"
      ]
    },
    "発": {
      "book": "上",
      "page": 32,
      "unit": "発見ノート",
      "readings": {
        "primary": "ハツ",
        "on": [
          "ハツ"
        ],
        "kun": [],
        "extra": [
          "ホツ"
        ]
      },
      "examples": [
        "発明"
      ]
    },
    "予": {
      "book": "上",
      "page": 32,
      "unit": "発見ノート",
      "readings": {
        "primary": "ヨ",
        "on": [
          "ヨ"
        ],
        "kun": [],
        "extra": []
      },
      "examples": [
        "予算"
      ]
    },
    "想": {
      "book": "上",
      "page": 32,
      "unit": "発見ノート",
      "readings": {
        "primary": "ソウ",
        "on": [
          "ソウ"
        ],
        "kun": [],
        "extra": [
          "ソ"
        ]
      },
      "examples": [
        "空想"
      ]
    },
    "調": {
      "book": "上",
      "page": 32,
      "unit": "発見ノート",
      "readings": {
        "primary": "しら-べる",